,CCI,/cci_items/cci_item/definition,Note,Parameter,index
3259,CCI-000840,The organization employs automated mechanisms to increase the availability of incident response-related information and support.,,,IR-7 (1)
3263,CCI-000841,"The organization establishes a direct, cooperative relationship between its incident response capability and external providers of information system protection capability.",,,IR-7 (2) ()
3267,CCI-000842,The organization identifies organizational incident response team members to the external providers.,,,IR-7 (2) ()
3271,CCI-000843,"The organization develops an incident response plan that provides the organization with a roadmap for implementing its incident response capability; describes the structure and organization of the incident response capability; provides a high-level approach for how the incident response capability fits into the overall organization; meets the unique requirements of the organization, which relate to mission, size, structure, and functions; defines reportable incidents; provides metrics for measuring the incident response capability within the organization; and defines the resources and management support needed to effectively maintain and mature an incident response capability.",,,IR-8 
3274,CCI-000844,The organization develops an incident response plan that is reviewed and approved by organization-defined personnel or roles.,,,IR-8 
3278,CCI-000845,The organization defines incident response personnel (identified by name and/or by role) and organizational elements to whom copies of the incident response plan are distributed.,,,IR-8 
3282,CCI-000846,The organization distributes copies of the incident response plan to organization-defined incident response personnel (identified by name and/or by role) and organizational elements.,,,IR-8 
3286,CCI-000847,The organization defines the frequency for reviewing the incident response plan.,,,IR-8 
3290,CCI-000848,The organization reviews the incident response plan on an organization-defined frequency.,,,IR-8 
3294,CCI-000849,"The organization updates the incident response plan to address system/organizational changes or problems encountered during plan implementation, execution, or testing.",,,IR-8 
3298,CCI-000850,The organization communicates incident response plan changes to organization-defined incident response personnel (identified by name and/or by role) and organizational elements.,,,IR-8 
3302,CCI-001628,The organization defines a frequency with which to review and update the current system maintenance procedures.,,,MA-1
3306,CCI-000854,The organization reviews and updates the current system maintenance policy in accordance with organization-defined frequency.,,,MA-1 
3310,CCI-000855,The organization develops and documents procedures to facilitate the implementation of the system maintenance policy and associated system maintenance controls.,,,MA-1 
3314,CCI-000856,The organization disseminates to organization-defined personnel or roles procedures to facilitate the implementation of the system maintenance policy and associated system maintenance controls.,,,MA-1 
3318,CCI-000857,The organization reviews and updates the current system maintenance procedures in accordance with organization-defined frequency.,,,MA-1 
3322,CCI-000851,The organization defines the frequency with which to review and update the current system maintenance policy.,,,MA-1
3326,CCI-000852,"The organization develops and documents a system maintenance policy that addresses purpose, scope, roles, responsibilities, management commitment, coordination among organizational entities, and compliance.",,,MA-1 
3330,CCI-000853,The organization disseminates to organization-defined personnel or roles a system maintenance policy.,,,MA-1 
3334,CCI-001629,"The organization employs automated mechanisms to produce up-to-date, accurate, complete, and available records of all maintenance and repair actions needed, in process, and complete.",,,MA-2 (2)
3337,CCI-000858,"The organization schedules, performs, documents, and reviews records of maintenance and repairs on information system components in accordance with manufacturer or vendor specifications and/or organizational requirements.",,,MA-2 
3340,CCI-000859,"The organization approves and monitors all maintenance activities, whether performed on site or remotely and whether the equipment is serviced on site or removed to another location.",,,MA-2 
3344,CCI-000860,The organization requires that organization-defined personnel or roles explicitly approve the removal of the information system or system components from organizational facilities for off-site maintenance or repairs.,,,MA-2 
3348,CCI-000861,The organization sanitizes equipment to remove all information from associated media prior to removal from organizational facilities for off-site maintenance or repairs.,,,MA-2 
3352,CCI-000862,The organization checks all potentially impacted security controls to verify that the controls are still functioning properly following maintenance or repair actions.,,,MA-2 
3356,CCI-000863,"The organization maintains maintenance records for the information system that include the date and time of maintenance, the name of the individual performing the maintenance, the name of escort, if necessary, a description of the maintenance performed, and a list of equipment removed or replaced (including identification numbers, if applicable).",,,MA-2 (1) ()()()()()
3359,CCI-000864,"The organization employs automated mechanisms to schedule, conduct, and document maintenance and repairs as required.",,,MA-2 (2)
3362,CCI-000865,The organization approves information system maintenance tools.,,,MA-3
3366,CCI-000866,The organization controls information system maintenance tools.,,,MA-3
3370,CCI-000867,The organization monitors information system maintenance tools.,,,MA-3
3374,CCI-000868,"The organization maintains, on an ongoing basis, information system maintenance tools.",,,MA-3
3377,CCI-000869,The organization inspects the maintenance tools carried into a facility by maintenance personnel for improper or unauthorized modifications.,,,MA-3 (1)
3381,CCI-000870,The organization checks media containing diagnostic and test programs for malicious code before the media are used in the information system.,,,MA-3 (2)
3386,CCI-000871,The organization prevents the unauthorized removal of maintenance equipment containing organizational information by: (a) verifying that there is no organizational information contained on the equipment; (b) sanitizing or destroying the equipment; (c) retaining the equipment within the facility; or (d) obtaining an exemption from organization-defined personnel or roles explicitly authorizing removal of the equipment from the facility.,,,MA-3 (3)
3390,CCI-000872,The organization employs automated mechanisms to restrict the use of maintenance tools to authorized personnel only.,,,MA-3 (4)
3394,CCI-001630,Designated organizational personnel review the maintenance records of the non-local maintenance and diagnostic sessions.,,,MA-4 (1)
3397,CCI-001631,"The organization, before removal from organizational facilities, and after the service is performed, inspects and sanitizes the component (with regard to potentially malicious software) before reconnecting the component to the information system.",,,MA-4 (3) ()
3401,CCI-001632,The organization protects nonlocal maintenance sessions by separating the maintenance session from other network sessions with the information system by either physically separated communications paths or logically separated communications paths based upon encryption.,,,MA-4 (4) () ()
3405,CCI-000873,The organization approves nonlocal maintenance and diagnostic activities.,,,MA-4 
3409,CCI-000874,The organization monitors nonlocal maintenance and diagnostic activities.,,,MA-4 
3413,CCI-000875,The organization controls non-local maintenance and diagnostic activities.,,,MA-4 
3416,CCI-000876,The organization allows the use of nonlocal maintenance and diagnostic tools only as consistent with organizational policy and documented in the security plan for the information system.,,,MA-4 
3420,CCI-000877,The organization employs strong authenticators in the establishment of nonlocal maintenance and diagnostic sessions.,,,MA-4 
3424,CCI-000878,The organization maintains records for nonlocal maintenance and diagnostic activities.,,,MA-4 
3428,CCI-000879,The organization terminates sessions and network connections when nonlocal maintenance is completed.,,,MA-4 
3432,CCI-000880,The organization audits non-local maintenance and diagnostic sessions.,,,MA-4 (1)
3435,CCI-000881,"The organization documents, in the security plan for the information system, the policies and procedures for the establishment and use of nonlocal maintenance and diagnostic connections.",,,MA-4 (2)
3439,CCI-000882,The organization requires that nonlocal maintenance and diagnostic services be performed from an information system that implements a security capability comparable to the capability implemented on the system being serviced.,,,MA-4 (3) ()
3443,CCI-000883,"The organization removes the component to be serviced from the information system and prior to nonlocal maintenance or diagnostic services, sanitizes the component (with regard to organizational information) before removal from organizational facilities.",,,MA-4 (3) ()
3447,CCI-000884,The organization protects nonlocal maintenance sessions by employing organization-defined authenticators that are replay resistant.,,,MA-4 (4)
3451,CCI-000885,"The organization requires that maintenance personnel notify organization-defined personnel when non-local maintenance is planned (i.e., date/time).",,,MA-4 (5) ()
3454,CCI-000886,The organization defines the personnel or roles to be notified of the date and time of planned nonlocal maintenance.,,,MA-4 (5) ()
3458,CCI-000887,The organization requires the approval of each nonlocal maintenance session by organization-defined personnel or roles.,,,MA-4 (5) ()
3462,CCI-000888,The organization employs cryptographic mechanisms to protect the integrity and confidentiality of non-local maintenance and diagnostic communications.,,,MA-4 (6)
3465,CCI-000889,The organization employs remote disconnect verification at the termination of non-local maintenance and diagnostic sessions.,,,MA-4 (7)
3468,CCI-000890,The organization establishes a process for maintenance personnel authorization.,,,MA-5 
3472,CCI-000891,The organization maintains a list of authorized maintenance organizations or personnel.,,,MA-5 
3476,CCI-000892,The organization ensures that personnel performing maintenance on the information system have required access authorizations or designates organizational personnel with required access authorizations and technical competence deemed necessary to supervise information system maintenance.,,,MA-5 
3479,CCI-000893,The organization implements procedures for the use of maintenance personnel that lack appropriate security clearances or are not U.S. citizens.,,,MA-5 (1)
3483,CCI-000894,"The organization requires maintenance personnel who do not have needed access authorizations, clearances, or formal access approvals to be escorted and supervised during the performance of maintenance and diagnostic activities on the information system by approved organizational personnel who are fully cleared, have appropriate access authorizations, and are technically qualified.",,,MA-5 (1) ()
3487,CCI-000895,"The organization requires that, prior to initiating maintenance or diagnostic activities by personnel who do not have needed access authorizations, clearances or formal access approvals, all volatile information storage components within the information system be sanitized and all nonvolatile storage media be removed or physically disconnected from the system and secured.",,,MA-5 (1) ()
3491,CCI-000896,"The organization requires that in the event an information system component cannot be sanitized, the procedures contained in the security plan for the system be enforced.",,,MA-5 (1) ()
3494,CCI-000897,"The organization ensures that personnel performing maintenance and diagnostic activities on an information system processing, storing, or transmitting classified information possess security clearances and formal access approvals for at least the highest classification level and for all compartments of information on the system.",,,MA-5 (2)
3498,CCI-000898,"The organization ensures that personnel performing maintenance and diagnostic activities on an information system processing, storing, or transmitting classified information are U.S. citizens.",,,MA-5 (3)
3502,CCI-000899,"The organization ensures that cleared foreign nationals (i.e., foreign nationals with appropriate security clearances) are used to conduct maintenance and diagnostic activities on classified information systems only when the systems are jointly owned and operated by the United States and foreign allied governments, or owned and operated solely by foreign allied governments.",,,MA-5 (4) ()
3506,CCI-000900,"The organization ensures that approvals, consents, and detailed operational conditions regarding the use of foreign nationals to conduct maintenance and diagnostic activities on classified information systems are fully documented within Memoranda of Agreements.",,,MA-5 (4) ()
3510,CCI-000901,The organization defines a list of security-critical information system components and/or key information technology components for which it will obtain maintenance support and/or spare parts.,,,MA-6
3513,CCI-000902,The organization defines a time period for obtaining maintenance support and/or spare parts for security-critical information system components and/or key information technology components.,,,MA-6
3516,CCI-000903,The organization obtains maintenance support and/or spare parts for organization-defined information system components within an organization-defined time period of failure.,,,MA-6
3520,CCI-000995,"The organization develops and documents a media protection policy that addresses purpose, scope, roles, responsibilities, management commitment, coordination among organizational entities, and compliance.",,,MP-1 
3524,CCI-000996,The organization disseminates to organization-defined personnel or roles a media protection policy.,,,MP-1 
3528,CCI-000997,The organization reviews and updates the current media protection policy in accordance with organization-defined frequency.,,,MP-1 
3532,CCI-000998,The organization defines a frequency for reviewing and updating the current media protection policy.,,,MP-1 
3536,CCI-000999,The organization develops and documents procedures to facilitate the implementation of the media protection policy and associated media protection controls.,,,MP-1 
3540,CCI-001000,The organization disseminates to organization-defined personnel or roles procedures to facilitate the implementation of the media protection policy and associated media protection controls.,,,MP-1 
3544,CCI-001001,The organization reviews and updates the current media protection procedures in accordance with organization-defined frequency.,,,MP-1 
3548,CCI-001002,The organization defines a frequency for reviewing and updating the current media protection procedures.,,,MP-1 
3552,CCI-001003,The organization restricts access to organization-defined types of digital and/or non-digital media to organization-defined personnel or roles.,,,MP-2
3556,CCI-001004,The organization defines types of digital and/or non-digital media for which the organization restricts access.,,,MP-2
3560,CCI-001005,The organization defines personnel or roles from which to restrict access to organization-defined types of digital and/or non-digital media.,,,MP-2
3564,CCI-001006,The organization defines security measures for restricting access to media.,,,MP-2
3567,CCI-001007,The organization employs automated mechanisms to restrict access to media storage areas.,,,MP-2 (1)
3571,CCI-001008,The organization employs automated mechanisms to audit access attempts and access granted to media storage areas.,,,MP-2 (1)
3575,CCI-001009,The information system uses cryptographic mechanisms to protect and restrict access to information on portable digital media.,,,MP-2 (2)
3578,CCI-001633,The organization defines removable media types and information output requiring marking.,,,MP-3 
3581,CCI-001010,"The organization marks information system media indicating the distribution limitations, handling caveats, and applicable security markings (if any) of the information.",,,MP-3 
3585,CCI-001011,The organization exempts organization-defined types of information system media from marking as long as the media remain within organization-defined controlled areas.,,,MP-3 
3589,CCI-001012,The organization defines types of information system media to exempt from marking as long as the media remain within organization-defined controlled areas.,,,MP-3 
3593,CCI-001013,The organization defines controlled areas where organization-defined types of information system media are exempt from being marked.,,,MP-3 
3597,CCI-001014,The organization physically controls and securely stores organization-defined types of digital and/or non-digital media within organization-defined controlled areas.,,,MP-4 
3601,CCI-001015,The organization defines types of digital and/or non-digital media to physically control and securely store within organization-defined controlled areas.,,,MP-4 
3605,CCI-001016,The organization defines controlled areas where organization-defined types of digital and/or non-digital media are physically controlled and securely stored.,,,MP-4 
3609,CCI-001017,The organization defines security measures for securing media storage.,,,MP-4 
3612,CCI-001018,"The organization protects information system media until the media are destroyed or sanitized using approved equipment, techniques, and procedures.",,,MP-4 
3616,CCI-001019,The organization employs cryptographic mechanisms to protect information in storage.,,,MP-4 (1)
3619,CCI-001020,The organization protects and controls organization-defined types of information system media during transport outside of controlled areas using organization-defined security safeguards.,,,MP-5 
3623,CCI-001021,The organization defines types of information system media protected and controlled during transport outside of controlled areas.,,,MP-5 
3627,CCI-001022,The organization defines security safeguards to be used to protect and control organization-defined types of information system media during transport outside of controlled areas.,,,MP-5 
3631,CCI-001023,The organization maintains accountability for information system media during transport outside of controlled areas.,,,MP-5 
3635,CCI-001024,The organization restricts the activities associated with the transport of information system media to authorized personnel.,,,MP-5 
3639,CCI-001025,The organization documents activities associated with the transport of information system media.,,,MP-5 (2)
3643,CCI-001026,The organization employs an identified custodian during transport of information system media outside of controlled areas.,,,MP-5 (3)
3647,CCI-001027,The information system implements cryptographic mechanisms to protect the confidentiality and integrity of information stored on digital media during transport outside of controlled areas.,,,MP-5 (4)
3651,CCI-001028,"The organization sanitizes organization-defined information system media prior to disposal, release out of organizational control, or release for reuse using organization-defined sanitization techniques and procedures in accordance with applicable federal and organizational standards and policies.",,,MP-6
3655,CCI-001029,"The organization tracks, documents, and verifies media sanitization and disposal actions.",,,MP-6 (1)
3658,CCI-001030,The organization tests sanitization equipment and procedures in accordance with the organization-defined frequency to verify that the intended sanitization is being achieved.,,,MP-6 (2)
3662,CCI-001031,The organization defines a frequency for testing sanitization equipment and procedures to verify that the intended sanitization is being achieved.,,,MP-6 (2)
3666,CCI-001032,The organization applies nondestructive sanitization techniques to portable storage devices prior to connecting such devices to the information system in accordance with organization-defined circumstances requiring sanitization of portable storage devices.,,,MP-6 (3)
3670,CCI-001033,The organization defines circumstances requiring sanitization of portable storage devices prior to connecting such devices to the information system.,,,MP-6 (3)
3674,CCI-001034,The organization sanitizes information system media containing Controlled Unclassified Information (CUI) or other sensitive information in accordance with applicable organizational and/or federal standards and policies.,,,MP-6 (4)
3677,CCI-001035,The organization sanitizes information system media containing classified information in accordance with NSA standards and policies.,,,MP-6 (5)
3680,CCI-001036,The organization destroys information system media that cannot be sanitized.,,,MP-6 (6)
3683,CCI-000904,"The organization develops and documents a physical and environmental protection policy that addresses purpose, scope, roles, responsibilities, management commitment, coordination among organizational entities, and compliance.",,,PE-1 
3687,CCI-000905,The organization disseminates a physical and environmental protection policy to organization-defined personnel or roles.,,,PE-1 
3691,CCI-000906,The organization reviews and updates the current physical and environmental protection policy in accordance with organization-defined frequency.,,,PE-1 
3695,CCI-000907,The organization defines the frequency with which to review and update the physical and environmental protection policy.,,,PE-1 
3699,CCI-000908,The organization develops and documents procedures to facilitate the implementation of the physical and environmental protection policy and associated physical and environmental protection controls.,,,PE-1 
3703,CCI-000909,The organization disseminates physical and environmental protection procedures to organization-defined personnel or roles.,,,PE-1 
3707,CCI-000910,The organization reviews and updates the current physical and environmental protection procedures in accordance with organization-defined frequency.,,,PE-1 
3711,CCI-000911,The organization defines the frequency with which to review and update the physical and environmental protection procedures.,,,PE-1 
3715,CCI-000956,The organization provides the capability of shutting off power to the information system or individual system components in emergency situations.,,,PE-10 
3719,CCI-000957,The organization places emergency shutoff switches or devices in an organization-defined location by information system or system component to facilitate safe and easy access for personnel.,,,PE-10 
3723,CCI-000958,The organization defines a location for emergency shutoff switches or devices by information system or system component.,,,PE-10 
3727,CCI-000959,The organization protects emergency power shutoff capability from unauthorized activation.,,,PE-10 
3731,CCI-000960,The organization provides a short-term uninterruptible power supply to facilitate an orderly shutdown of the information system in the event of a primary power source loss.,,,PE-11
3734,CCI-000961,The organization provides a long-term alternate power supply for the information system that is capable of maintaining minimally required operational capability in the event of an extended loss of the primary power source.,,,PE-11 (1)
3738,CCI-000962,The organization provides a long-term alternate power supply for the information system that is self-contained and not reliant on external power generation.,,,PE-11 (2)
3741,CCI-000963,The organization employs and maintains automatic emergency lighting for the information system that activates in the event of a power outage or disruption and that covers emergency exits and evacuation routes within the facility.,,,PE-12
3745,CCI-000964,The organization provides emergency lighting for all areas within the facility supporting essential missions and business functions.,,,PE-12 (1)
3748,CCI-000968,The organization employs an automatic fire suppression capability for the information system when the facility is not staffed on a continuous basis.,,,PE-13 (3)
3752,CCI-000969,"The organization ensures that the facility undergoes, on an organization-defined frequency, fire marshal inspections and promptly resolves identified deficiencies.",,,PE-13 (4)
3755,CCI-000970,The organization defines a frequency for fire marshal inspections.,,,PE-13 (4)
3758,CCI-000965,The organization employs and maintains fire suppression and detection devices/systems for the information system that are supported by an independent energy source.,,,PE-13
3762,CCI-000966,The organization employs fire detection devices/systems for the information system that activate automatically and notify the organization and emergency responders in the event of a fire.,,,PE-13 (1)
3765,CCI-000967,The organization employs fire suppression devices/systems for the information system that provide automatic notification of any activation to the organization and emergency responders.,,,PE-13 (2)
3768,CCI-000971,The organization maintains temperature and humidity levels within the facility where the information system resides at organization-defined acceptable levels.,,,PE-14 
3772,CCI-000972,The organization defines acceptable temperature and humidity levels to be maintained within the facility where the information system resides.,,,PE-14 
3776,CCI-000973,The organization monitors temperature and humidity levels in accordance with organization-defined frequency.,,,PE-14 
3780,CCI-000974,The organization defines a frequency for monitoring temperature and humidity levels.,,,PE-14 
