,CCI,/cci_items/cci_item/definition,Note,Parameter,index
6286,CCI-002294,"The organization defines the objects to be associated, and that association maintained, with organization-defined security attributes in accordance with organization-defined security policies.",,,AC-16 (6)
6288,CCI-002295,The organization allows personnel to associate organization-defined security attributes with organization-defined subjects in accordance with organization-defined security policies.,,,AC-16 (6)
6290,CCI-002296,The organization allows personnel to associate organization-defined security attributes with organization-defined objects in accordance with organization-defined security policies.,,,AC-16 (6)
6292,CCI-002297,The organization allows personnel to maintain the association of organization-defined security attributes with organization-defined subjects in accordance with organization-defined security policies.,,,AC-16 (6)
6294,CCI-002298,The organization allows personnel to maintain the association of organization-defined security attributes with organization-defined objects in accordance with organization-defined security policies.,,,AC-16 (6)
6296,CCI-002299,The organization provides a consistent interpretation of security attributes transmitted between distributed information system components.,,,AC-16 (7)
6298,CCI-002300,The organization defines the techniques or technologies to be implemented when associating security attributes with information.,,,AC-16 (8)
6300,CCI-002301,The organization defines the level of assurance to be provided when implementing organization-defined techniques or technologies in associating security attributes to information.,,,AC-16 (8)
6302,CCI-002302,The information system implements organization-defined techniques or technologies with an organization-defined level of assurance in associating security attributes to information.,,,AC-16 (8)
6304,CCI-002303,The organization defines the techniques or procedures to be employed to validate re-grading mechanisms.,,,AC-16 (9)
6306,CCI-002304,The organization ensures security attributes associated with information are reassigned only via re-grading mechanisms validated using organization-defined techniques or procedures.,,,AC-16 (9)
6308,CCI-002305,The organization identifies individuals authorized to define or change the type and value of security attributes available for association with subjects and objects.,,,AC-16 (10)
6310,CCI-002306,The information system provides authorized individuals the capability to define or change the type of security attributes available for association with subjects.,,,AC-16 (10)
6312,CCI-002307,The information system provides authorized individuals the capability to define or change the value of security attributes available for association with subjects.,,,AC-16 (10)
6314,CCI-002308,The information system provides authorized individuals the capability to define or change the type of security attributes available for association with objects.,,,AC-16 (10)
6316,CCI-002309,The information system provides authorized individuals the capability to define or change the value of security attributes available for association with objects.,,,AC-16 (10)
6318,CCI-002310,The organization establishes and documents usage restrictions for each type of remote access allowed.,,,AC-17 
6320,CCI-002311,The organization establishes and documents configuration/connection requirements for each type of remote access allowed.,,,AC-17 
6322,CCI-002312,The organization establishes and documents implementation guidance for each type of remote access allowed.,,,AC-17 
6324,CCI-002313,The information system controls remote access methods.,,,AC-17 (1)
6328,CCI-002315,The organization defines the number of managed network access control points through which the information system routes all remote access.,,,AC-17 (3)
6330,CCI-002316,The organization authorizes access to security-relevant information via remote access only for organization-defined needs.,,,AC-17 (4) ()
6332,CCI-002317,The organization defines the operational needs for when the execution of privileged commands via remote access is to be authorized.,,,AC-17 (4) ()
6334,CCI-002318,The organization defines the operational needs for when access to security-relevant information via remote access is to be authorized.,,,AC-17 (4) ()
6336,CCI-002319,The organization documents in the security plan for the information system the rationale for authorization of the execution of privilege commands via remote access.,,,AC-17 (4) ()
6338,CCI-002320,The organization documents in the security plan for the information system the rationale for authorization of access to security-relevant information via remote access.,,,AC-17 (4) ()
6340,CCI-002321,The organization defines the time period within which it disconnects or disables remote access to the information system.,,,AC-17 (9)
6342,CCI-002322,The organization provides the capability to expeditiously disconnect or disable remote access to the information system within the organization-defined time period.,,,AC-17 (9)
6344,CCI-002323,The organization establishes configuration/connection requirements for wireless access.,,,AC-18 
6346,CCI-002324,The organization identifies and explicitly authorizes users allowed to independently configure wireless networking capabilities.,,,AC-18 (4)
6348,CCI-002325,The organization establishes configuration requirements for organization-controlled mobile devices.,,,AC-19 
6350,CCI-002326,The organization establishes connection requirements for organization-controlled mobile devices.,,,AC-19 
6352,CCI-002327,The organization defines the security policies which restrict the connection of classified mobile devices to classified information systems.,,,AC-19 (4) ()
6354,CCI-002328,The organization restricts the connection of classified mobile devices to classified information systems in accordance with organization-defined security policies.,,,AC-19 (4) ()
6356,CCI-002329,The organization defines the mobile devices that are to employ full-device or container encryption to protect the confidentiality and integrity of the information on the device.,,,AC-19 (5)
6358,CCI-002330,The organization employs full-device encryption or container encryption to protect the confidentiality of information on organization-defined mobile devices.,,,AC-19 (5)
6360,CCI-002331,The organization employs full-device encryption or container encryption to protect the integrity of information on organization-defined mobile devices.,,,AC-19 (5)
6362,CCI-002110,The organization defines the information system account types that support the organizational missions/business functions.,,,AC-2 
6364,CCI-002111,The organization identifies and selects the organization-defined information system account types of information system accounts which support organizational missions/business functions.,,,AC-2 
6366,CCI-002112,The organization assigns account managers for information system accounts.,,,AC-2 
6368,CCI-002113,The organization establishes conditions for role membership.,,,AC-2 
6370,CCI-002114,The organization specifies authorized users of the information system for each account.,,,AC-2 
6372,CCI-002115,The organization specifies authorized users of the information system.,,,AC-2 
6374,CCI-002116,The organization specifies authorized group membership on the information system.,,,AC-2 
6376,CCI-002117,The organization specifies authorized role membership on the information system.,,,AC-2 
6378,CCI-002118,"The organization specifies access authorizations (i.e., privileges) for each account on the information system.",,,AC-2 
6380,CCI-002119,The organization specifies other attributes for each account on the information system.,,,AC-2 
6382,CCI-002120,The organization defines the personnel or roles authorized to approve the creation of information system accounts.,,,AC-2 
6384,CCI-002121,"The organization defines the procedures or conditions to be employed when creating, enabling, modifying, disabling, and removing information system accounts.",,,AC-2 
6386,CCI-002122,The organization monitors the use of information system accounts.,,,AC-2 
6388,CCI-002123,The organization notifies account managers when accounts are no longer required.,,,AC-2  1
6390,CCI-002124,The organization notifies account managers when users are terminated or transferred.,,,AC-2  2
6392,CCI-002125,The organization notifies account managers when individual information system usage or need-to-know changes.,,,AC-2  3
6394,CCI-002126,The organization authorizes access to the information system based on a valid access authorization.,,,AC-2  1
6396,CCI-002127,The organization authorizes access to the information system based on intended system usage.,,,AC-2  2
6398,CCI-002128,The organization authorizes access to the information system based on other attributes as required by the organization or associated missions/business functions.,,,AC-2  3
6400,CCI-002129,The organization establishes a process for reissuing shared/group account credentials (if deployed) when individuals are removed from the group.,,,AC-2 
6402,CCI-002130,The information system automatically audits account enabling actions.,,,AC-2 (4)
6404,CCI-002131,"The organization defines the personnel or roles to be notified on account creation, modification, enabling, disabling, and removal actions.",,,AC-2 (4)
6406,CCI-002132,The information system notifies organization-defined personnel or roles for account enabling actions.,,,AC-2 (4)
6408,CCI-002133,The organization defines other conditions when users are required to log out.,,,AC-2 (5)
6410,CCI-002134,The organization defines a list of dynamic privilege management capabilities to be implemented by the information system.,,,AC-2 (6)
6412,CCI-002135,The information system implements the organization-defined list of dynamic privilege management capabilities.,,,AC-2 (6)
6414,CCI-002136,The organization defines the actions to be taken when privileged role assignments are no longer appropriate.,,,AC-2 (7) ()
6416,CCI-002137,The organization takes organization-defined actions when privileged role assignments are no longer appropriate.,,,AC-2 (7) ()
6418,CCI-002138,The organization defines the information system accounts that can be dynamically created.,,,AC-2 (8)
6420,CCI-002139,The information system creates organization-defined information system accounts dynamically.,,,AC-2 (8)
6422,CCI-002140,The organization defines the conditions for establishing shared/group accounts.,,,AC-2 (9)
6424,CCI-002141,The organization only permits the use of shared/group accounts that meet organization-defined conditions for establishing shared/group accounts.,,,AC-2 (9)
6426,CCI-002142,The information system terminates shared/group account credentials when members leave the group.,,,AC-2 (10)
6428,CCI-002143,The organization defines the circumstances and/or usage conditions that are to be enforced for organization-defined information system accounts.,,,AC-2 (11)
6430,CCI-002144,The organization defines the information system accounts that are to be subject to the enforcement of organization-defined circumstances and/or usage conditions.,,,AC-2 (11)
6432,CCI-002145,The information system enforces organization-defined circumstances and/or usage conditions for organization-defined information system accounts.,,,AC-2 (11)
6434,CCI-002146,The organization defines atypical usage for which the information system accounts are to be monitored.,,,AC-2 (12) ()
6436,CCI-002147,The organization monitors information system accounts for organization-defined atypical use.,,,AC-2 (12) ()
6438,CCI-002148,The organization defines the personnel or roles to whom atypical usage of information system accounts are to be reported.,,,AC-2 (12) ()
6440,CCI-002149,The organization reports atypical usage of information system accounts to organization-defined personnel or roles.,,,AC-2 (12) ()
6442,CCI-002150,The organization defines the time period within which the accounts of users posing a significant risk are to be disabled after discovery of the risk.,,,AC-2 (13)
6444,CCI-002151,The organization disables accounts of users posing a significant risk within an organization-defined time period of discovery of the risk.,,,AC-2 (13)
6446,CCI-002332,"The organization establishes terms and conditions, consistent with any trust relationships established with other organizations owning, operating, and/or maintaining external information systems, allowing authorized individuals to process, store, or transmit organization-controlled information using the external information systems.",,,AC-20 
6448,CCI-002333,The organization permits authorized individuals to use an external information system to access the information system only when the organization verifies the implementation of required security controls on the external system as specified in the organization's information security policy and security plan.,,,AC-20 (1) ()
6450,CCI-002334,The organization permits authorized individuals to use an external information system to process organization-controlled information only when the organization verifies the implementation of required security controls on the external system as specified in the organization's information security policy and security plan.,,,AC-20 (1) ()
6452,CCI-002335,The organization permits authorized individuals to use an external information system to store organization-controlled information only when the organization verifies the implementation of required security controls on the external system as specified in the organization's information security policy and security plan.,,,AC-20 (1) ()
6454,CCI-002336,The organization permits authorized individuals to use an external information system to transmit organization-controlled information only when the organization verifies the implementation of required security controls on the external system as specified in the organization's information security policy and security plan.,,,AC-20 (1) ()
6456,CCI-002337,"The organization permits authorized individuals to use an external information system to access the information system or to process, store, or transmit organization-controlled information only when the organization retains approved information system connection or processing agreements with the organizational entity hosting the external information system.",,,AC-20 (1) ()
6458,CCI-002338,"The organization restricts or prohibits the use of non-organizationally owned information systems, system components, or devices to process, store, or transmit organizational information.",,,AC-20 (3)
6460,CCI-002339,The organization defines the network accessible storage devices that are to be prohibited from being used in external information systems.,,,AC-20 (4)
6462,CCI-002340,The organization prohibits the use of organization-defined network accessible storage devices in external information systems.,,,AC-20 (4)
6464,CCI-002341,The organization defines the information sharing restrictions to be enforced by the information system for information search and retrieval services.,,,AC-21 (2)
6466,CCI-002342,The information system implements information search and retrieval services that enforce organization-defined information sharing restrictions.,,,AC-21 (2)
6468,CCI-002343,The organization defines the data mining prevention techniques to be employed to adequately protect organization-defined data storage objects against data mining.,,,AC-23
6470,CCI-002344,The organization defines the data mining detection techniques to be employed to adequately detect data mining attempts against organization-defined data storage objects.,,,AC-23
6472,CCI-002345,The organization defines the data storage objects that are to be protected against data mining attempts.,,,AC-23
6474,CCI-002346,The organization employs organization-defined data mining prevention techniques for organization-defined data storage objects to adequately protect against data mining.,,,AC-23
6476,CCI-002347,The organization employs organization-defined data mining detection techniques for organization-defined data storage objects to adequately detect data mining attempts.,,,AC-23
6478,CCI-002348,The organization defines the access control decisions that are to be applied to each access request prior to access enforcement.,,,AC-24
6480,CCI-002349,The organization establishes procedures to ensure organization-defined access control decisions are applied to each access request prior to access enforcement.,,,AC-24
6482,CCI-002350,The organization defines the access authorization information that is to be transmitted using organization-defined security safeguards to organization-defined information systems that enforce access control decisions.,,,AC-24 (1)
6484,CCI-002351,The organization defines the security safeguards to be employed when transmitting organization-defined access authorization information to organization-defined information systems that enforce access control decisions.,,,AC-24 (1)
6486,CCI-002352,The organization defines the information systems that are to be recipients of organization-defined access authorization information using organization-defined security safeguards.,,,AC-24 (1)
6488,CCI-002353,The information system transmits organization-defined access authorization information using organization-defined security safeguards to organization-defined information systems which enforce access control decisions.,,,AC-24 (1)
6490,CCI-002354,"The organization defines the security attributes, not to include the identity of the user or process acting on behalf of the user, to be used as the basis for enforcing access control decisions.",,,AC-24 (2)
6492,CCI-002355,The information system enforces access control decisions based on organization-defined security attributes that do not include the identity of the user or process acting on behalf of the user.,,,AC-24 (2)
6494,CCI-002356,The organization defines the access control policies to be implemented by the information system's reference monitor.,,,AC-25
6496,CCI-002357,The information system implements a reference monitor for organization-defined access control policies that is tamperproof.,,,AC-25
6498,CCI-002358,The information system implements a reference monitor for organization-defined access control policies that is always invoked.,,,AC-25
6500,CCI-002359,"The information system implements a reference monitor for organization-defined access control policies that is small enough to be subject to analysis and testing, the completeness of which can be assured.",,,AC-25
6502,CCI-002152,The organization defines other actions necessary for which dual authorization is to be enforced.,,,AC-3 (2)
6504,CCI-002153,The organization defines the mandatory access control policies that are to be enforced over all subjects and objects.,,,AC-3 (3)
6506,CCI-002154,The mandatory access control policy specifies that the policy is uniformly enforced across all subjects and objects within the boundary of the information system.,,,AC-3 (3) ()
6508,CCI-002155,The mandatory access control policy specifies that a subject that has been granted access to information is constrained from passing the information to unauthorized subjects or objects.,,,AC-3 (3) () (1)
6510,CCI-002156,The mandatory access control policy specifies that a subject that has been granted access to information is constrained from granting its privileges to other subjects.,,,AC-3 (3) () (2)
6512,CCI-002157,"The mandatory access control policy specifies that a subject that has been granted access to information is constrained from changing one or more security attributes on subjects, objects, the information system, or information system components.",,,AC-3 (3) () (3)
6514,CCI-002158,The mandatory access control policy specifies that a subject that has been granted access to information is constrained from choosing the security attributes to be associated with newly created or modified objects.,,,AC-3 (3) () (4)
6516,CCI-002159,The mandatory access control policy specifies that a subject that has been granted access to information is constrained from choosing the attribute values to be associated with newly created or modified objects.,,,AC-3 (3) () (4)
6518,CCI-002160,The mandatory access control policy specifies that a subject that has been granted access to information is constrained from changing the rules governing access control.,,,AC-3 (3) () (5)
6520,CCI-002161,The organization defines subjects which may explicitly be granted organization-defined privileges such that they are not limited by some or all of the mandatory access control constraints.,,,AC-3 (3) ()
6522,CCI-002162,The organization defines the privileges that may explicitly be granted to organization-defined subjects such that they are not limited by some or all of the mandatory access control constraints.,,,AC-3 (3) ()
6524,CCI-002163,The organization defines the discretionary access control policies the information system is to enforce over subjects and objects.,,,AC-3 (4)
6526,CCI-002164,"The organization specifies in the discretionary access control policies that a subject that has been granted access to information can do one or more of the following: pass the information to any other subjects or objects; grant its privileges to other subjects; change security attributes on subjects, objects, the information system, or the information system's components; choose the security attributes to be associated with newly created or revised objects; and/or change the rules governing access control.",,,AC-3 (4)
6528,CCI-002165,The information system enforces organization-defined discretionary access control policies over defined subjects and objects.,,,AC-3 (4)
6530,CCI-002166,The organization defines the role-based access control policies the information system is to enforce over all subjects and objects.,,,AC-3 (7)
6532,CCI-002167,The organization defines the subjects over which the information system will enforce a role-based access control policy.,,,AC-3 (7)
6534,CCI-002168,The organization defines the objects over which the information system will enforce a role-based access control policy.,,,AC-3 (7)
6536,CCI-002169,The information system enforces a role-based access control policy over defined subjects and objects.,,,AC-3 (7)
6538,CCI-002170,The information system controls access based upon organization-defined roles and users authorized to assume such roles.,,,AC-3 (7)
6540,CCI-002171,The information system enforces a role-based access control policy over organization-defined subjects.,,,AC-3 (7)
6542,CCI-002172,The information system enforces a role-based access control policy over organization-defined objects.,,,AC-3 (7)
6544,CCI-002173,The organization defines the roles for which the information system will control access based upon the organization-defined role-based access control policy.,,,AC-3 (7)
6546,CCI-002174,The organization defines the users for which the information system will control access based upon the organization-defined role-based access control policy.,,,AC-3 (7)
6548,CCI-002175,"The information system controls access based upon organization-defined roles authorized to assume such roles, employing the organization-defined role-based access control policy.",,,AC-3 (7)
6550,CCI-002176,"The information system controls access based upon organization-defined users authorized to assume such roles, employing the organization-defined role-based access control policy.",,,AC-3 (7)
6552,CCI-002177,The organization defines the rules which will govern the timing of revocation of access authorizations.,,,AC-3 (8)
6554,CCI-002178,The information system enforces the revocation of access authorizations resulting from changes to the security attributes of subjects based on organization-defined rules governing the timing of revocations of access authorizations.,,,AC-3 (8)
6556,CCI-002179,The information system enforces the revocation of access authorizations resulting from changes to the security attributes of objects based on organization-defined rules governing the timing of revocations of access authorizations.,,,AC-3 (8)
6558,CCI-002180,The organization defines the security safeguards the organization-defined information system or system component is to provide to protect information released outside the established system boundary.,,,AC-3 (9) ()
6560,CCI-002181,The organization defines information systems or system components that are to provide organization-defined security safeguards to protect information received outside the established system boundary.,,,AC-3 (9) ()
6562,CCI-002182,The information system does not release information outside of the established system boundary unless the receiving organization-defined information system or system component provides organization-defined security safeguards.,,,AC-3 (9) ()
6564,CCI-002183,The organization defines the security safeguards to be used to validate the appropriateness of the information designated for release.,,,AC-3 (9) ()
6566,CCI-002184,The information system does not release information outside of the established system boundary unless organization-defined security safeguards are used to validate the appropriateness of the information designated for release.,,,AC-3 (9) ()
6568,CCI-002185,The organization defines the conditions on which it will employ an audited override of automated access control mechanisms.,,,AC-3 (10)
6570,CCI-002186,The organization employs an audited override of automated access control mechanisms under organization-defined conditions.,,,AC-3 (10)
6572,CCI-003014,The information system enforces organization-defined mandatory access control policies over all subjects and objects.,,,AC-3 (3)
