,CCI,/cci_items/cci_item/definition,Note,Parameter,index
0,CCI-001545,The organization defines a frequency for reviewing and updating the access control policy.,,,AC-1 
4,CCI-001546,The organization defines a frequency for reviewing and updating the access control procedures.,,,AC-1 
8,CCI-000001,"The organization develops an access control policy that addresses purpose, scope, roles, responsibilities, management commitment, coordination among organizational entities, and compliance.","The policy will address purpose, scope, roles, responsibilities, management commitment, coordination among organizational entities, and compliance.",Access Control Policy Document,AC-1 
12,CCI-000004,The organization develops procedures to facilitate the implementation of the access control policy and associated access controls.,,Access Control Policy Procedures,AC-1 
16,CCI-000002,The organization disseminates the access control policy to organization-defined personnel or roles.,"The policy will address purpose, scope, roles, responsibilities, management commitment, coordination among organizational entities, and compliance.",Record of distribution history of access control policy,AC-1 
20,CCI-000003,The organization reviews and updates the access control policy in accordance with organization-defined frequency.,"The policy will address purpose, scope, roles, responsibilities, management commitment, coordination among organizational entities, and compliance.","Document of Review, Comments, and Changes of access control policy",AC-1 
24,CCI-000005,The organization disseminates the procedures to facilitate access control policy and associated access controls to the organization-defined personnel or roles.,,Record of distribution history of procedures for implementing access control policy,AC-1 
28,CCI-000006,The organization reviews and updates the access control procedures in accordance with organization-defined frequency.,,Document of Changes of procedures for implementing access control policy,AC-1 
32,CCI-000054,The information system limits the number of concurrent sessions for each organization-defined account and/or account type to an organization-defined number of sessions.,"The organization may define the maximum number of concurrent sessions for an information system account globally, by account type, by account, or a combination. This control addresses concurrent sessions for a given information system account and does not address concurrent sessions by a single user via multiple system accounts.",,AC-10
36,CCI-000055,The organization defines the maximum number of concurrent sessions to be allowed for each organization-defined account and/or account type.,,,AC-10
40,CCI-000056,The information system retains the session lock until the user reestablishes access using established identification and authentication procedures.,,,AC-11 
44,CCI-000057,The information system initiates a session lock after the organization-defined time period of inactivity.,,,AC-11 
48,CCI-000058,The information system provides the capability for users to directly initiate session lock mechanisms.,,,AC-11 
52,CCI-000059,The organization defines the time period of inactivity after which the information system initiates a session lock.,,,AC-11 
56,CCI-000060,"The information system conceals, via the session lock, information previously visible on the display with a publicly viewable image.",,,AC-11 (1)
60,CCI-000061,The organization identifies and defines organization-defined user actions that can be performed on the information system without identification or authentication consistent with organizational missions/business functions.,,,AC-14 
64,CCI-000062,The organization permits actions to be performed without identification and authentication only to the extent necessary to accomplish mission/business objectives.,,,AC-14 (1)
67,CCI-000232,"The organization documents and provides supporting rationale in the security plan for the information system, user actions not requiring identification and authentication.",,,AC-14 
71,CCI-001559,The organization identifies the individuals authorized to change the value of associated security attributes.,,,AC-16 (2)
75,CCI-001560,The organization identifies individuals (or processes acting on behalf of individuals) authorized to associate organization-defined security attributes with organization-defined objects.,,,AC-16 (4)
79,CCI-001424,The information system dynamically associates security attributes with organization-defined subjects in accordance with organization-defined security policies as information is created and combined.,,,AC-16 (1)
83,CCI-001425,The information system provides authorized individuals (or processes acting on behalf of individuals) the capability to change the value of associated security attributes.,,,AC-16 (2)
87,CCI-001426,The information system maintains the binding of security attributes to information with sufficient assurance that the information--attribute association can be used as the basis for automated policy actions.,,,AC-16 (3)
90,CCI-001427,The information system allows authorized users to associate security attributes with information.,,,AC-16 (4)
93,CCI-001428,"The information system displays security attributes in human-readable form on each object that the system transmits to output devices to identify organization-identified special dissemination, handling, or distribution instructions using organization-identified human-readable, standard naming conventions.",,,AC-16 (5)
97,CCI-001429,"The organization identifies special dissemination, handling, or distribution instructions for identifying security attributes on output.",,,AC-16 (5)
101,CCI-001430,"The organization identifies human-readable, standard naming conventions for identifying security attributes on output.",,,AC-16 (5)
105,CCI-001396,The organization defines security attributes for which the information system supports and maintains the bindings for information in storage.,,,AC-16
108,CCI-001397,The organization defines security attributes for which the information system supports and maintains the bindings for information in process.,,,AC-16
111,CCI-001398,The organization defines security attributes for which the information system supports and maintains the bindings for information in transmission.,,,AC-16
114,CCI-001399,The information system supports and maintains the binding of organization-defined security attributes to information in storage.,,,AC-16
117,CCI-001400,The information system supports and maintains the binding of organization-defined security attributes to information in process.,,,AC-16
120,CCI-001401,The information system supports and maintains the binding of organization-defined security attributes to information in transmission.,,,AC-16
123,CCI-001561,The organization defines managed access control points for remote access to the information system.,,,AC-17 (3)
127,CCI-001562,The organization defines the appropriate action(s) to be taken if an unauthorized remote connection is discovered.,,,AC-17 (5)
130,CCI-000063,The organization defines allowed methods of remote access to the information system.,,,AC-17 
134,CCI-000064,The organization establishes usage restrictions and implementation guidance for each allowed remote access method.,,,AC-17 
137,CCI-000065,The organization authorizes remote access to the information system prior to allowing such connections.,,,AC-17 
141,CCI-000066,The organization enforces requirements for remote connections to the information system.,,,AC-17 
144,CCI-000067,The information system monitors remote access methods.,,,AC-17 (1)
148,CCI-000068,The information system implements cryptographic mechanisms to protect the confidentiality of remote access sessions.,,,AC-17 (2)
152,CCI-000069,The information system routes all remote accesses through an organization-defined number of managed network access control points.,,,AC-17 (3)
156,CCI-000070,The organization authorizes the execution of privileged commands via remote access only for organization-defined needs.,,,AC-17 (4)
160,CCI-000071,The organization monitors for unauthorized remote connections to the information system on an organization-defined frequency.,,,AC-17 (5)
163,CCI-000072,The organization ensures that users protect information about remote access mechanisms from unauthorized use and disclosure.,,,AC-17 (6)
167,CCI-000079,The organization ensures that remote sessions for accessing an organization-defined list of security functions and security-relevant information employ organization-defined additional security measures.,,,AC-17 (7)
170,CCI-001431,The organization defines a frequency for monitoring for unauthorized remote connections to the information system.,,,AC-17 (5)
173,CCI-001432,The organization takes appropriate action if an unauthorized remote connection to the information system is discovered.,,,AC-17 (5)
176,CCI-001433,The organization defines a list of security functions and security-relevant information that for remote access sessions have organization-defined security measures employed and are audited.,,,AC-17 (7)
179,CCI-001434,The organization defines additional security measures to be employed when an organization-defined list of security functions and security-relevant information is accessed remotely.,,,AC-17 (7)
182,CCI-001435,The organization defines networking protocols within the information system deemed to be nonsecure.,,,AC-17 (8)
185,CCI-001436,The organization disables organization-defined networking protocols within the information system deemed to be nonsecure except for explicitly identified components in support of specific operational requirements.,,,AC-17 (8)
188,CCI-001437,The organization documents the rationale for the execution of privileged commands and access to security-relevant information in the security plan for the information system.,,,AC-17 (4)
191,CCI-001453,The information system implements cryptographic mechanisms to protect the integrity of remote access sessions.,,,AC-17 (2)
195,CCI-001454,The organization ensures that remote sessions for accessing an organization-defined list of security functions and security-relevant information are audited.,,,AC-17 (7)
198,CCI-001455,The organization explicitly identifies components needed in support of specific operational requirements.,,,AC-17 (8)
201,CCI-001402,The organization monitors for unauthorized remote access to the information system.,,,AC-17 
204,CCI-001563,The organization defines the appropriate action(s) to be taken if an unauthorized wireless connection is discovered.,,,AC-18 (2)
207,CCI-001438,The organization establishes usage restrictions for wireless access.,,,AC-18 
211,CCI-001439,The organization establishes implementation guidance for wireless access.,,,AC-18 
215,CCI-001440,The organization monitors for unauthorized wireless access to the information system.,,,AC-18 
218,CCI-001441,The organization authorizes wireless access to the information system prior to allowing such connections.,,,AC-18 
222,CCI-001442,The organization enforces requirements for wireless connections to the information system.,,,AC-18 
225,CCI-001443,The information system protects wireless access to the system using authentication of users and/or devices.,,,AC-18 (1)
229,CCI-001444,The information system protects wireless access to the system using encryption.,,,AC-18 (1)
233,CCI-001445,The organization monitors for unauthorized wireless connections to the information system on an organization-defined frequency.,,,AC-18 (2)
236,CCI-001446,The organization scans for unauthorized wireless access points on an organization-defined frequency.,,,AC-18 (2)
239,CCI-001447,"The organization defines a frequency of monitoring for unauthorized wireless connections to information system, including scans for unauthorized wireless access points.",,,AC-18 (2)
242,CCI-001448,The organization takes appropriate action if an unauthorized wireless connection is discovered.,,,AC-18 (2)
245,CCI-001449,"The organization disables, when not intended for use, wireless networking capabilities internally embedded within information system components prior to issuance and deployment.",,,AC-18 (3)
249,CCI-001450,The organization does not allow users to independently configure wireless networking capabilities.,,,AC-18 (4)
252,CCI-001451,The organization selects radio antennas and calibrates transmission power levels to reduce the probability that usable signals can be received outside of organization-controlled boundaries.,,,AC-18 (5)
256,CCI-000082,The organization establishes usage restrictions for organization-controlled mobile devices.,,,AC-19 
260,CCI-000083,The organization establishes implementation guidance for organization-controlled mobile devices.,,,AC-19 
264,CCI-000084,The organization authorizes connection of mobile devices to organizational information systems.,,,AC-19 
268,CCI-000085,The organization monitors for unauthorized connections of mobile devices to organizational information systems.,,,AC-19 
271,CCI-000086,The organization enforces requirements for the connection of mobile devices to organizational information systems.,,,AC-19 
274,CCI-000087,The organization disables information system functionality that provides the capability for automatic execution of code on mobile devices without user direction.,,,AC-19 
277,CCI-000088,The organization issues specially configured mobile devices to individuals traveling to locations that the organization deems to be of significant risk in accordance with organizational policies and procedures.,,,AC-19 
280,CCI-000089,The organization applies organization-defined inspection and preventative measures to mobile devices returning from locations that the organization deems to be of significant risk in accordance with organizational policies and procedures.,,,AC-19 
283,CCI-000090,"The organization restricts the use of writable, removable media in organizational information systems.",,,AC-19 (1)
286,CCI-000091,"The organization prohibits the use of personally-owned, removable media in organizational information systems.",,,AC-19 (2)
289,CCI-000092,The organization prohibits the use of removable media in organizational information systems when the media has no identifiable owner.,,,AC-19 (3)
292,CCI-001456,The organization defines locations that the organization deems to be of significant risk in accordance with organizational policies and procedures.,,,AC-19 
295,CCI-001457,The organization defines inspection and preventative measures to be applied on mobile devices returning from locations that the organization deems to be of significant risk in accordance with organizational policies and procedures.,,,AC-19 
298,CCI-001458,"The organization requires that if classified information is found on mobile devices, the incident handling policy be followed.",,,AC-19 (4) ()
302,CCI-001330,"The organization prohibits the use of unclassified mobile devices in facilities containing information systems processing, storing, or transmitting classified information unless specifically permitted by the authorizing official.",,,AC-19 (4) ()
306,CCI-001331,The organization prohibits connection of unclassified mobile devices to classified information systems.,,,AC-19 (4) ()
310,CCI-001332,The organization requires approval from the authorizing official for the connection of unclassified mobile devices to unclassified information systems.,,,AC-19 (4) ()
314,CCI-001333,"The organization prohibits use of internal or external modems or wireless interfaces within unclassified mobile devices in facilities containing information systems processing, storing, or transmitting classified information.",,,AC-19 (4) ()
318,CCI-001334,"The organization requires that unclassified mobile devices used in facilities containing information systems processing, storing, or transmitting classified information and the information stored on those devices be subject to random reviews and inspections by organization-defined security officials.",,,AC-19 (4) ()
322,CCI-001335,"The organization defines security officials to perform reviews and inspections of unclassified mobile devices in facilities containing information systems processing, storing, or transmitting classified information.",,,AC-19 (4) ()
326,CCI-001547,The organization defines the frequency on which it will review information system accounts for compliance with account management requirements.,,,AC-2 
330,CCI-000007,"The organization manages information system accounts by identifying account types (i.e., individual, group, system, application, guest/anonymous, and temporary).",,,AC-2 
333,CCI-000008,The organization establishes conditions for group membership.,,,AC-2 
337,CCI-000009,The organization manages information system accounts by identifying authorized users of the information system and specifying access privileges.,,,AC-2 
340,CCI-000010,The organization requires approvals by organization-defined personnel or roles for requests to create information system accounts.,,,AC-2 
344,CCI-000011,"The organization creates, enables, modifies, disables, and removes information system accounts in accordance with organization-defined procedures or conditions.",,,AC-2 
348,CCI-000012,The organization reviews information system accounts for compliance with account management requirements per organization-defined frequency.,Organization-defined frequency,,AC-2 
352,CCI-000013,"The organization manages information system accounts by notifying account managers when temporary accounts are no longer required and when information system users are terminated, transferred, or information system usage or need-to-know/need-to-share changes.",,,AC-2 
355,CCI-000014,The organization manages information system accounts by granting access to the system based on a valid access authorization; intended system usage; and other attributes as required by the organization or associated missions/business functions.,,Organizational Policy identifying the process for user accounts.,AC-2 
358,CCI-000015,The organization employs automated mechanisms to support the information system account management functions.,,,AC-2 (1)
362,CCI-000016,The information system automatically removes or disables temporary accounts after an organization-defined time period for each type of account.,,,AC-2 (2)
366,CCI-000017,The information system automatically disables inactive accounts after an organization-defined time period.,,,AC-2 (3)
370,CCI-000018,The information system automatically audits account creation actions.,,,AC-2 (4)
374,CCI-000019,The organization requires that users log out in accordance with the organization-defined time period of inactivity or description of when to log out.,Other defined situation could be policy that users must log out at the end of the day.,,AC-2 (5) ()
378,CCI-000020,The information system dynamically manages user privileges and associated access authorizations.,,TBD,AC-2 (6)
381,CCI-000237,The organization manages information system accounts by specifically authorizing and monitoring the use of guest/anonymous accounts and temporary accounts.,,Procedures for the monitoring of assigned guest/anonymous accounts.,AC-2 
384,CCI-000208,The organization determines normal time-of-day and duration usage for information system accounts.,,,AC-2 (5) ()
387,CCI-001361,The organization defines a time period after which temporary accounts are automatically terminated.,,,AC-2 (2)
391,CCI-001365,The organization defines a time period after which emergency accounts are automatically terminated.,,,AC-2 (2)
395,CCI-000217,The organization defines a time period after which inactive accounts are automatically disabled.,,,AC-2 (3)
399,CCI-001403,The information system automatically audits account modification actions.,,,AC-2 (4)
403,CCI-001404,The information system automatically audits account disabling actions.,,,AC-2 (4)
407,CCI-001405,The information system automatically audits account removal actions.,,,AC-2 (4)
411,CCI-001406,The organization defines a time period of expected inactivity when users are required to log out.,,,AC-2 (5) ()
415,CCI-001407,The organization administers privileged user accounts in accordance with a role-based access scheme that organizes allowed information system access and privileges into roles.,,,AC-2 (7) ()
419,CCI-001354,The organization manages information system accounts by deactivating temporary accounts that are no longer required.,,,AC-2 
422,CCI-001355,The organization manages information system accounts by deactivating accounts of terminated or transferred users.,,,AC-2 
425,CCI-001356,The organization monitors for atypical usage of information system accounts.,,,AC-2 (5) ()
428,CCI-001357,The organization reports atypical usage to designated organizational officials.,,,AC-2 (5) ()
431,CCI-001358,The organization establishes privileged user accounts in accordance with a role-based access scheme that organizes allowed information system access and privileges into roles.,,,AC-2 (7) ()
435,CCI-001359,The organization tracks privileged role assignments.,,,AC-2 (7) ()
438,CCI-001360,The organization monitors privileged role assignments.,,,AC-2 (7) ()
442,CCI-001682,The information system automatically removes or disables emergency accounts after an organization-defined time period for each type of account.,,,AC-2 (2)
446,CCI-001683,The information system notifies organization-defined personnel or roles for account creation actions.,,,AC-2 (4)
450,CCI-001684,The information system notifies organization-defined personnel or roles for account modification actions.,,,AC-2 (4)
454,CCI-001685,The information system notifies organization-defined personnel or roles for account disabling actions.,,,AC-2 (4)
458,CCI-001686,The information system notifies organization-defined personnel or roles for account removal actions.,,,AC-2 (4)
462,CCI-000093,"The organization establishes terms and conditions, consistent with any trust relationships established with other organizations owning, operating, and/or maintaining external information systems, allowing authorized individuals to access the information system from the external information systems.",,,AC-20 
466,CCI-000094,"The organization establishes terms and conditions, consistent with any trust relationships established with other organizations owning, operating, and/or maintaining external information systems, allowing authorized individuals to process organization-controlled information using the external information systems.",,,AC-20 
469,CCI-000095,The organization prohibits authorized individuals from using an external information system to access the information system except in situations where the organization can verify the implementation of required security controls on the external system as specified in the organization's information security policy and security plan.,,,AC-20 (1) ()
472,CCI-000096,"The organization prohibits authorized individuals from using an external information system to access the information system or to process, store, or transmit organization-controlled information except in situations where the organization has approved information system connection or processing agreements with the organizational entity hosting the external information system.",,,AC-20 (1) ()
475,CCI-000097,The organization restricts or prohibits the use of organization-controlled portable storage devices by authorized individuals on external information systems.,,,AC-20 (2)
479,CCI-001465,"The organization establishes terms and conditions, consistent with any trust relationships established with other organizations owning, operating, and/or maintaining external information systems, allowing authorized individuals to store organization-controlled information using the external information systems.",,,AC-20 
482,CCI-001466,"The organization establishes terms and conditions, consistent with any trust relationships established with other organizations owning, operating, and/or maintaining external information systems, allowing authorized individuals to transmit organization-controlled information using the external information systems.",,,AC-20 
485,CCI-001467,The organization prohibits authorized individuals from using an external information system to process organization-controlled information except in situations where the organization can verify the implementation of required security controls on the external system as specified in the organization's information security policy and security plan.,,,AC-20 (1) ()
488,CCI-001468,The organization prohibits authorized individuals from using an external information system to store organization-controlled information except in situations where the organization can verify the implementation of required security controls on the external system as specified in the organization's information security policy and security plan.,,,AC-20 (1) ()
491,CCI-001469,The organization prohibits authorized individuals from using an external information system to transmit organization-controlled information except in situations where the organization can verify the implementation of required security controls on the external system as specified in the organization's information security policy and security plan.,,,AC-20 (1) ()
494,CCI-000098,The organization facilitates information sharing by enabling authorized users to determine whether access authorizations assigned to the sharing partner match the access restrictions on the information for organization-defined information circumstances where user discretion is required.,,,AC-21 
498,CCI-000099,The information system enforces information-sharing decisions by authorized users based on access authorizations of sharing partners and access restrictions on information to be shared.,,,AC-21 (1)
